url,pid,name,brand,currency,selling_price,original_price,discount_percentage,availability,color,description,usage,reviews,rating,likes_count,size,breadcrumbs,images,ingredients,highlights,uniq_id,scraped_at
https://www.sephora.com/ca/en/product/sunnydays-lightweight-foundation-P500046?skuId=2582138,P500046,SunnyDays Lightweight Foundation,Tower 28 Beauty,CAD,,38.0,,InStock, 05 Fairfax - fair with pink undertones,"<b>What it is: </b>An everyday, lightweight foundation that contains skin-soothing ingredients to visibly even redness.<br><br><b>Coverage: </b>Light<br><b><br>Finish:</b> Natural<br><b><br>Formulation: </b>Liquid<br><b><br>Highlighted Ingredients:<br></b>- Aloe and Centella: Soothe skin and provide antioxidant support.<br>- Prickly Pear Extract: Cares for skin and helps protect from blue-light pollution.<br><br><b>Ingredient Callouts:</b> It is vegan, gluten-free, and cruelty-free.<br><br><b>What Else You Need to Know:</b> This easy-to-apply, light-to-medium coverage, protective foundation evens the look of redness, soothes irritation, helps shield skin from blue light, and has a natural-looking finish so your real skin (freckles included) can have its moment to shine. The formula is fragrance-free, alcohol-free, non-oxidizing, and won&rsquo;t cause breakouts. It is also the first and only complexion makeup product with the National Eczema Association's Seal of Acceptance.","<b>Suggested Usage:<br></b>Light/Sheer Coverage (to even out redness, discoloration):<br>-Apply with your fingertips like moisturizer and blend out.<br><br>Medium/Buildable Coverage (to cover blemishes, discoloration):<br>-Tap on with a dampened beauty sponge, foundation brush, or stippling brush. <br>-Tap to layer for higher coverage.<br><br><b>Recycling Instructions:<br></b>-SunnyDays packaging is made with 50 percent recycled post-consumer resin, which actively diverts waste from landfills.",23,4.2609,4066,1 oz / 30 mL,"Makeup, Face, Foundation","https://www.sephora.com/productimages/sku/s2582138-av-1-zoom.jpg, https://www.sephora.com/productimages/sku/s2582138-av-2-zoom.jpg, https://www.sephora.com/productimages/sku/s2582138-av-3-zoom.jpg, https://www.sephora.com/productimages/sku/s2582138-av-4-zoom.jpg, https://www.sephora.com/productimages/sku/s2582138-av-5-zoom.jpg, https://www.sephora.com/productimages/sku/s2582138-av-6-zoom.jpg, https://www.sephora.com/productimages/sku/s2582138-av-7-zoom.jpg, https://www.sephora.com/productimages/sku/s2582138-av-8-zoom.jpg, https://www.sephora.com/productimages/sku/s2582138-av-9-zoom.jpg","-Aloe and Centella: Soothe skin and provide antioxidant support.<br>-Prickly Pear Extract: Cares for skin and helps protect from blue-light pollution.<br><br>Water/Aqua/Eau, Isononyl Isononanoate, Zinc Oxide, C9-12 Alkane, Butyloctyl Salicylate, Polyglyceryl-6 Polyricinoleate, Caprylic/Capric Triglyceride, Glycerin, Ethylhexyl Methoxycrylene, Trimethylsiloxysilicate, Mica, Polyglyceryl-2 Isostearate, Sodium Chloride, Phenoxyethanol, Disteardimonium Hectorite, Polyglyceryl-3 Polyricinoleate, Polyhydroxystearic Acid, Polyglyceryl-6 Polyhydroxystearate, Coco-Caprylate/Caprate, Isostearic Acid, Lecithin, Jojoba Esters, Ethylhexylglycerin, Sodium Phytate, Aloe Barbadensis Leaf Water, Centella Asiatica Leaf Water, Opuntia Tuna Fruit, Salvia Officinalis (Sage) Extract, Tocopherol, Ascorbyl Palmitate, (+/-): Iron Oxides (Ci 77491, Ci 77492, Ci 77499), Titanium Dioxide (Ci 77891).",Light Coverage | Vegan | Sustainable Packaging | Natural Finish | Fragrance Free | Good for: Acne/Blemishes,21807dd0-05c5-5a03-a313-5f432c5d1bd1,30/06/2022 21:45:42
https://www.sephora.com/ca/en/product/argan-bright-skin-vitamin-c-serum-P446641?skuId=2229763,P446641,Argan Bright Skin Vitamin C Serum,Josie Maran,CAD,$81.70,86.0,5.00,InStock,,"<b>What it is: </b> A stabilized vitamin C serum that visibly evens tone, reduces the look of dark spots, and brightens dull skin. <br><br><b>Skin Type: </b>Normal and Dry <br><br><b>Skincare Concerns: </b>Dullness and Uneven Texture, Dryness, and Dark Spots <br><br><b>Formulation: </b>Lightweight Serum<br><br><b>Highlighted Ingredients:</b><br>- Stabilized Vitamin C: Absorbs to increase radiance and glow. <br>- Rice Bran, Marshmallow Root, and Licorice Root: Boost luminosity. <br>- 100 Percent Pure Argan Oil: Infuses skin with vitamin E, antioxidants, and firming omega essential fatty acids. <br><br><b> Ingredient Callouts: </b>This product is cruelty-free and gluten-free, and comes in recyclable packaging. <br><br><b>What Else You Need to Know: </b>This argan oil-based serum delivers active ingredients quicker and deeper into the skin for faster, visible results. Bioavailable vitamin C absorbs instantly to diminish dark spots and fight hyperpigmentation, while argan oil hydrates and visibly firms for a radiant, glowing complexion.<br><br><b>Clean at Sephora</b><br>Clean at Sephora is a curation of brands committed to evolving the beauty industry. When you see our Clean seal, you can be sure this brand's products are formulated without certain ingredients that are potentially harmful to human health and the environment and also address ingredients clients are concerned about, including phthalates, formaldehyde or formaldehyde releasers, oxybenzone and octinoxate, hydroquinone, triclosan, coal tar, methylisothiazolinone and methylchloroisothiazolinone, insoluble plastic microbeads, and more. For the full list, check out the Ingredients tab.<br>","<b>Suggested Usage:</b><br>-In the morning, apply two to four drops to clean skin. <br>-Follow with SPF, moisturizer, and/or pure oil. ",525,4.3981,10727,0.85 oz/ 25 mL,"Skincare, Treatments, Face Serums","https://www.sephora.com/productimages/product/p446641-av-01-zoom.jpg, https://www.sephora.com/productimages/product/p446641-av-02-zoom.jpg, https://www.sephora.com/productimages/product/p446641-av-03-zoom.jpg, https://www.sephora.com/productimages/product/p446641-av-04-zoom.jpg"," -Stabilized Vitamin C: Absorbs to increase radiance and glow. <br>-Rice Bran, Marshmallow Root, and Licorice Root: Boost luminosity. <br>-100 Percent Pure Argan Oil: Infuses skin with vitamin E, antioxidants, and firming omega essential fatty acids.<br><br>Argania Spinosa (Argan) Kernel Oil, Coconut Alkanes, Oleyl Lactate, Octyldodecyl Pca, Tetrahexyldecyl Ascorbate, Glyceryl Oleate, Dimethyl Isosorbide, Isostearyl Lactate, Brassica Campestris (Rapeseed) Seed Oil, Glycyrrhiza Glabra (Licorice) Root Extract, Polyglyceryl-3 Diisostearate, Althaea Officinalis Root Extract, Oryza Sativa (Rice) Bran Extract, Pterocarpus Marsupium Bark Extract, Bisabolol, Phloretin, Coco-Caprylate/Caprate, Squalane, Olea Europaea (Olive) Fruit Oil, Dunaliella Salina Extract (Beta Carotene Source).<br><br>
<b>Clean at Sephora products are formulated without the following banned or restricted ingredients (please see Clean at Sephora landing page for full list of specific restrictions and allowances by category – this is not an exhaustive list): </b><br>
Acrylates, Aluminum Salts, Animal Musks/Fats/Oils, Benzophenones and related compounds, Butoxyethanol, Butylated hydroxyanisole (BHA), Butylated hydroxytulolene (BHT) under 0.1% , Carbon Black or Black 2, Coal Tar, Ethanolamines, Formaldehyde and Formaldehyde Releasing Agents, Hydroquinone, Lead and Lead Acetate, Mercury + Mercury Compounds (Thimerisol), Methoxyethanol, Methyl Cellosolve, Methylchloroisothiazolinone and Methylisothiazolinone, Mineral Oil, Nanomaterials (restrictions for specific nanomaterials only), Oxybenzone, Parabens, Petrolatum and Parrafin (USP grade only), Phenoxyethanol under 1%, Phthalates, Plastic Microbeads, Polyacrylamide & Acrylamide, Resorcinol, Retinyl Palmitate, Styrene, Sulfates, Talc (no detection of asbestos) , Toluene, Triclosan and Triclocarban, Undisclosed Synthetic Fragrance (under 1% and formulated without Acetaldehyde, Acetone, Acetonitrile, Benzalkonium chloride, BPA, EDTA, Methylene chloride, PTFE, PFOA), 1, 4, Dioxane (ingredients must comply with impurity thresholds), Octinoxate, PFAS compounds, Nitromusks and Polycyclic Musks, Ethoxylated Ingredients (including PEGS or polyethylene glycol must meet contamination limits for 1’4 Dioxane and ethylene oxide), Cyclic Silicones, EDTA and derivatives (allowed if no technical substitute under 0.2%)",Cruelty-Free | Vegan | Clean at Sephora,bb6a72c5-6d02-50c0-84d4-6897c909194e,30/06/2022 21:45:42
https://www.sephora.com/ca/en/product/mini-lip-cheek-P437097?skuId=2448488,P437097,Lip + Cheek Cream Blush Stick,MILK MAKEUP,CAD,$26.60,28.0,5.00,InStock, Dash - Light Pink,"<b>What it is: </b>A two-in-one cream blush and lip color formulated with hydrating ingredients for buildable, blendable color.<br><br><b>Highlighted Ingredients: <br></b>- Mango Butter, Avocado Oil, and Apricot Oil: Hydrate skin and help the formula seamlessly blend in. <br><br><b>Ingredient Callouts:</b> This product is gluten-free and cruelty-free.<br><br><b>What Else You Need to Know:</b> This cream lip and cheek color comes in a stick that&lsquo;s quick and easy to use, so you can swipe, blend, and go&mdash;no mirror required. The hydrating formula builds color seamlessly and blends in easily with your fingertips, sponge, or brush.<br><br><b>Clean at Sephora<br></b>Clean at Sephora is a curation of brands committed to evolving the beauty industry. When you see our Clean seal, you can be sure this brand's products are formulated without certain ingredients that are potentially harmful to human health and the environment and also address ingredients clients are concerned about, including phthalates, formaldehyde or formaldehyde releasers, oxybenzone and octinoxate, hydroquinone, triclosan, coal tar, methylisothiazolinone and methylchloroisothiazolinone, insoluble plastic microbeads, and more. For the full list, check out the Ingredients tab.<br>","<b>Suggested Usage:<br></b>-Swipe the stick directly onto lips, cheeks, or both.<br>-Blend in with your fingertips, brush, or sponge.<br>-Build for more color payoff.<br>-Lip + Cheek blends seamlessly with Milk Makeup Highlighter (sold separately) and Milk Makeup Matte Bronzer (sold separately) for a healthy allover glow.",1051,4.1808,158116,0.21 oz/ 6 g,"Makeup, Cheek, Blush","https://www.sephora.com/productimages/product/p437097-av-02-zoom.jpg, https://www.sephora.com/productimages/product/p437097-av-03-zoom.jpg, https://www.sephora.com/productimages/sku/s2448488-av-02-zoom.jpg, https://www.sephora.com/productimages/sku/s2448488-av-04-zoom.jpg, https://www.sephora.com/productimages/sku/s2448488-av-01-zoom.jpg, https://www.sephora.com/productimages/sku/s2448488-av-05-zoom.jpg, https://www.sephora.com/productimages/sku/s2448488-av-03-zoom.jpg","Ricinus Communis (Castor) Seed Oil, Persea Gratissima (Avocado) Oil, Ethylhexyl Palmitate, Helianthus Annuus (Sunflower) Seed Wax, Euphorbia Cerifera (Candelilla) Wax/Cire de Candelilla, C12-15 Alkyl Benzoate, Isononyl Isononanoate, Silica, Fragrance (Parfum), Citrus Aurantium Dulcis (Orange) Peel Wax, Mangifera Indica (Mango) Seed Butter, Prunus Armeniaca (Apricot) Kernel Oil, Tocopheryl Acetate, Hydrogenated Vegetable Oil/Huile Végétale Hydrogénée, Stearalkonium Hectorite, Synthetic Fluorphlogopite, Propylene Carbonate, Isopropyl Myristate, Sorbitan Tristearate, Polyhydroxystearic Acid, Bis-stearyl Dimethicone, Isopropyl Titanium Triisostearate, Tin Oxide, Mica, Palmitic Acid, Limonene, Linalool,  Titanium Dioxide (CI 77891), Iron Oxides (CI 77499), Red 28 Lake (CI 45410), Red 30 Lake (CI 73360), Yellow 5 Lake (CI 19140)<b>Clean at Sephora products are formulated without the following banned or restricted ingredients (please see Clean at Sephora landing page for full list of specific restrictions and allowances by category – this is not an exhaustive list): </b><br>
Acrylates, Aluminum Salts, Animal Musks/Fats/Oils, Benzophenones and related compounds, Butoxyethanol, Butylated hydroxyanisole (BHA), Butylated hydroxytulolene (BHT) under 0.1% , Carbon Black or Black 2, Coal Tar, Ethanolamines, Formaldehyde and Formaldehyde Releasing Agents, Hydroquinone, Lead and Lead Acetate, Mercury + Mercury Compounds (Thimerisol), Methoxyethanol, Methyl Cellosolve, Methylchloroisothiazolinone and Methylisothiazolinone, Mineral Oil, Nanomaterials (restrictions for specific nanomaterials only), Oxybenzone, Parabens, Petrolatum and Parrafin (USP grade only), Phenoxyethanol under 1%, Phthalates, Plastic Microbeads, Polyacrylamide & Acrylamide, Resorcinol, Retinyl Palmitate, Styrene, Sulfates, Talc (no detection of asbestos) , Toluene, Triclosan and Triclocarban, Undisclosed Synthetic Fragrance (under 1% and formulated without Acetaldehyde, Acetone, Acetonitrile, Benzalkonium chloride, BPA, EDTA, Methylene chloride, PTFE, PFOA), 1, 4, Dioxane (ingredients must comply with impurity thresholds), Octinoxate, PFAS compounds, Nitromusks and Polycyclic Musks, Ethoxylated Ingredients (including PEGS or polyethylene glycol must meet contamination limits for 1’4 Dioxane and ethylene oxide), Cyclic Silicones, EDTA and derivatives (allowed if no technical substitute under 0.2%)",Natural Finish | Without Parabens  | Vegan | Clean at Sephora,a18d54df-61ae-53e1-8ef9-ec1ae3c77ac5,30/06/2022 21:45:42
https://www.sephora.com/ca/en/product/dyson-airwrap-multi-styler-complete-P500738?skuId=2609030,P500738,Dyson Airwrap™ multi-styler Complete,Dyson,CAD,,749.99,,PreOrder,,"<b>What it is:  </b>A multi-styler to smooth and hide flyaways with no extreme heat&mdash;its re-engineered barrels now curl in both directions, brushes for straighter styles, and a new Coanda Smoothing dryer harness enhanced Coanda airflow for faster, better, easier styling.<br><b>Key Benefits:<br></b>- Dries and styles simultaneously  <br>- Curl, shape, and smooth while hiding flyaways  <br>- Dry and style with no extreme heat<br><br><b>Dyson Airwrap&trade; Multi-Styler Complete&mdash;for Multiple Hair Types and Styles:<br></b>- New Coanda smoothing dryer: Multi-functional attachment dries, smooths, and hides flyaways.1<br>- Re-engineered 30mm Airwrap&trade; barrel: Creates loose, bouncy curls or waves in hair. It now curl in both directions with one barrel.          <br>- Re-engineered 40mm Airwrap&trade; barrel: Creates voluminous curls and waves in hair. It now curl in both directions with one barrel.          <br>- Re-engineered Soft smoothing brush: Gently aligns and smooths fine hair with increased control, for straighter styles.2<br>- Re-engineered Firm smoothing brush:  Smooths and shapes frizz-prone4 hair with increased control, for straighter styles.2<br>- Round volumizing brush: Volumizes and shapes fine, flat hair. <br>- Storage case: Neatly stores your Dyson Airwrap &trade; multi-styler and its attachments.<br>- Filter cleaning brush: Quickly cleans your Dyson Airwrap&trade; filter. <br><br><b>If You Want to Know More:<br></b>Dries and styles simultaneously&mdash;with no extreme heat:<br>- Some styling tools use extreme temperatures to break bonds in the hair and reset them in a new shape. This can cause permanent damage to the hair. The Dyson Airwrap&trade; multi-styler styles hair from wet to dry using Coanda airflow, not extreme heat.<br><br>The Coanda effect&mdash;style with air, not extreme heat: <br>- The Dyson Airwrap&trade; multi-styler harnesses an aerodynamic phenomenon called the Coanda effect. It uses air to attract and wrap hair to the barrel, or surface of the brush.<br><br>Powered by the Dyson digital motor V9: <br>- The 13-blade impeller spins at up to 110,000rpm, generating 3.2kPa. Powerful enough to produce the air pressure that creates the Coanda effect.<br><br>Intelligent heat control:<br>- Measures airflow temperature over 40 times a second, intelligently controlling the heating element to prevent extreme heat damage.<br><br>Negative ions:<br>- Charged particles in the airflow help reduce static in the hair.<br><br>Key controls: <br>- Airflow speed&mdash;three precise airflow speeds, to suit your styling.<br>- Temperature control&mdash;three precise heat settings.<br>- Cold shot&mdash;immediately deactivates the heating element, for cooler air to set your style.<br><br>Prussian blue storage case:<br>- Protects and neatly stores your Dyson Airwrap&trade; multi-styler and attachments. It&lsquo;s finished in Prussian blue, cushioned with soft fabric and with a removable lid that is also a non-slip mat for your multi-styler.<br><br>Warranty: This product comes with a free two-year parts and labor warranty when you register your tool on the Dyson website.<br><br>Caveats:<br>1 vs. original Dyson Aiwrap&trade; smoothing brushes <br>2vs. original Dyson Airwrap&trade; Smoothing brushes<br>3vs. original Dyson Airwrap&trade; Smoothing brushes. For use on dry and straight(ened) hair. <br>4vs. untreated hair. Real life results may vary.","<b>Suggested Use:<br>Tips to help curl:<br></b>-Start with damp towel-dried hair.<br>-Apply mousse/memory mist to damp hair.<br>-Use 30mm barrel.<br>-Use high heat and high airflow to curl.<br>-End with a cool shot to set style.<br>-Make sure the curled hair is completely dry before you turn the machine off.<br>-Add styling product such as hairspray to maximize the curl longevity.<b><br><br>How to create waves and shape:<br></b>-Begin with wet hair.<br>-Attach Pre-styling dryer.<br>-Dry to damp using Pre-styling dryer.<br>-Attach the Round volumizing brush.<br>-Select medium power and high heat.<br>-Smooth the brush through to the ends of your hair.<br>-Roll hair up from the ends to the roots.<br>-Hold until your hair is dry.<br>-Push the cold shot to set the curl.<br>-Release the curl.<br>-Repeat throughout your hair.<b><br><br>How to create voluminous curls:<br></b>-Begin with wet hair.<br>-Attach the Firm or Soft smoothing brush.<br>-Select full power and medium heat.<br>-Dry hair until damp.<br>-Section your hair.<br>-Switch to the 30mm barrel.<br>-Select full power and high heat.<br>-Take a small section of hair.<br>-Introduce the ends of your hair to the arrows on barrel.<br>-Once hair begins to wrap, move the barrel towards your head without twisting.<br>-Hold until your hair is dry.<br>-Push the cold shot to set the curl.<br>-Switch off and pull down to release the curl.<br>-Gently loosen curl with your fingers to create a voluminous look.<b><br><br>Six steps to curl retention:<br></b>-Start with damp, towel-dried hair.<br>-Use the 30mm barrel for a defined curl.<br>-Use high heat and airflow.<br>-Make sure curl is completely dry before you turn the machine off.<br>-End with cool shot to set style.<br>-Add styling product such as hairspray to maximize curl longevity.<b><br></b>",8,2.125,782,,"Hair, Tools, Curling Irons","https://www.sephora.com/productimages/sku/s2609030-av-2-zoom.jpg, https://www.sephora.com/productimages/sku/s2609030-av-3-zoom.jpg, https://www.sephora.com/productimages/sku/s2609030-av-4-zoom.jpg, https://www.sephora.com/productimages/sku/s2609030-av-5-zoom.jpg, https://www.sephora.com/productimages/sku/s2609030-av-6-zoom.jpg, https://www.sephora.com/productimages/sku/s2609030-av-7-zoom.jpg, https://www.sephora.com/productimages/sku/s2609030-av-8-zoom.jpg, https://www.sephora.com/productimages/sku/s2609030-av-9-zoom.jpg",,,4ae23dd0-148a-54a0-9c11-fe72c59b3dc9,30/06/2022 21:45:42
https://www.sephora.com/ca/en/product/lawless-classic-cream-lipstick-P454981?skuId=2294478,P454981,Satin Luxe Classic Cream Lipstick,LAWLESS,CAD,$35.15,37.0,5.00,OutOfStock, Baby - neutral baby-pink,"<b>What it is: </b>A satin cream lipstick that is saturated with pigment and made with nurturing oils, waxes, and vitamin E.<br><br><b>Highlighted Ingredients: </b><br>- Jojoba Oil: Hydrates and nurtures dry, chapped lips.<br>- Candelilla Wax: Helps soften and support lips. <br>- Castor Oil: Helps soothe and condition dry lips.<br><br><b> Ingredient Callouts:</b> This product is vegan, cruelty-free, and gluten-free.<br><br><b>What Else You Need to Know:</b> This lipstick comes in versatile nudes so everyone can find their perfect neutral shade. They contrast beautifully against a wide range of skin tones and define and contour the lips. This formula is also highly pigmented and free of ingredients we may not want to swallow every day.<br><br><b>Clean at Sephora</b><br>Clean at Sephora is a curation of brands committed to evolving the beauty industry. When you see our Clean seal, you can be sure this brand's products are formulated without certain ingredients that are potentially harmful to human health and the environment and also address ingredients clients are concerned about, including phthalates, formaldehyde or formaldehyde releasers, oxybenzone and octinoxate, hydroquinone, triclosan, coal tar, methylisothiazolinone and methylchloroisothiazolinone, insoluble plastic microbeads, and more. For the full list, check out the Ingredients tab.<br>","<b>Suggested Usage:</b><br>-Apply Satin Luxe lipstick straight from the bullet.<br><br>Pro Tips:<br>-Exfoliate your lips first for a smoother, more even application.<br>-Use a lip liner one to two shades deeper than your lipstick to outline the perimeter of your lips for a subtle, lip-enhancing contour.<br>-Apply your perfect nude all over, then apply a lighter shade only in the center of the lips for a poutier, fuller-lip effect.<br>-Overdrawing your lips only at the Cupid’s bow and center of the bottom lip gives the illusion of fuller lips while looking natural and undetectable.<br>-The best way to use a nude lipstick to make your lips look fuller is choosing a shade that’s slightly deeper or brighter than your skin tone so that your lips don’t disappear.",67,3.6866,17879,0.1 oz/ 4.2 g,"Makeup, Lip, Lipstick",https://www.sephora.com/productimages/product/p454981-av-01-zoom.jpg," -Jojoba Oil: Hydrates and nurtures dry, chapped lips.<br>-Candelilla Wax: Helps soften and support lips. <br>-Castor Oil: Helps soothe and condition dry lips.<br><br> Ricinus Communis (Castor) Seed Oil, Caprylic/Capric Triglyceride, Oryza Sativa (Rice) Bran Wax, Euphorbia Cerifera (Candelilla) Wax, Copernicia Cerifera (Carnauba) Wax, Simmondsia Chinensis (Jojoba) Seed Oil, Olea Europaea (Olive) Fruit Oil, Tocopheryl Acetate, Vanillin, Tocopherol, Dehydroacetic Acid, +Benzyl Alcohol. May Contain: Iron Oxides (CI 77491, CI 77492, CI 77499) *Titanium Dioxide (CI 77891), Blue 1 Lake (CI 42090), Red 27 Lake (CI 45410), Red 6 (CI 15850), Red 6 Lake (CI 15850), Red 7 Lake (CI 15850), Yellow 5 Lake (CI 19140).<br><br><b>Clean at Sephora products are formulated without the following banned or restricted ingredients (please see Clean at Sephora landing page for full list of specific restrictions and allowances by category – this is not an exhaustive list): </b><br>
Acrylates, Aluminum Salts, Animal Musks/Fats/Oils, Benzophenones and related compounds, Butoxyethanol, Butylated hydroxyanisole (BHA), Butylated hydroxytulolene (BHT) under 0.1% , Carbon Black or Black 2, Coal Tar, Ethanolamines, Formaldehyde and Formaldehyde Releasing Agents, Hydroquinone, Lead and Lead Acetate, Mercury + Mercury Compounds (Thimerisol), Methoxyethanol, Methyl Cellosolve, Methylchloroisothiazolinone and Methylisothiazolinone, Mineral Oil, Nanomaterials (restrictions for specific nanomaterials only), Oxybenzone, Parabens, Petrolatum and Parrafin (USP grade only), Phenoxyethanol under 1%, Phthalates, Plastic Microbeads, Polyacrylamide & Acrylamide, Resorcinol, Retinyl Palmitate, Styrene, Sulfates, Talc (no detection of asbestos) , Toluene, Triclosan and Triclocarban, Undisclosed Synthetic Fragrance (under 1% and formulated without Acetaldehyde, Acetone, Acetonitrile, Benzalkonium chloride, BPA, EDTA, Methylene chloride, PTFE, PFOA), 1, 4, Dioxane (ingredients must comply with impurity thresholds), Octinoxate, PFAS compounds, Nitromusks and Polycyclic Musks, Ethoxylated Ingredients (including PEGS or polyethylene glycol must meet contamination limits for 1’4 Dioxane and ethylene oxide), Cyclic Silicones, EDTA and derivatives (allowed if no technical substitute under 0.2%)",Hydrating | Satin Finish | Without Sulfates SLS & SLES | Without Silicones | Clean at Sephora,5d66bca0-753e-51e4-8289-e005ebb43161,30/06/2022 21:45:42
